{
  "$schema": "https://json-schema.org/draft/2020-12/schema",
  "$id": "https://schemas.srcos.ai/nlboot/boot-release-set.schema.v0.1.json",
  "title": "SourceOS BootReleaseSet v0.1",
  "description": "A bootable SourceOS lifecycle object binding a ReleaseSet to signed boot artifacts, NLBoot manifest refs, platform adapters, live/install/recovery channels, and proof requirements.",
  "type": "object",
  "additionalProperties": false,
  "required": [
    "schemaVersion",
    "kind",
    "bootReleaseSetId",
    "baseReleaseSetRef",
    "bootMode",
    "signedManifestRef",
    "channels",
    "artifacts",
    "platformAdapters",
    "authorization",
    "offlineFallback",
    "signing",
    "proofs"
  ],
  "properties": {
    "schemaVersion": { "const": "v0.1" },
    "kind": { "const": "BootReleaseSet" },
    "bootReleaseSetId": { "type": "string", "pattern": "^urn:srcos:boot-release-set:" },
    "baseReleaseSetRef": { "type": "string", "pattern": "^urn:srcos:release-set:" },
    "bootMode": { "type": "string", "enum": ["installer", "recovery", "ephemeral", "bootstrap"] },
    "signedManifestRef": { "type": "string", "pattern": "^urn:srcos:boot-manifest:" },
    "channels": {
      "type": "array",
      "minItems": 1,
      "items": { "type": "string", "enum": ["live", "installer", "recovery", "rollback", "rescue", "bootstrap"] }
    },
    "artifacts": {
      "type": "object",
      "additionalProperties": false,
      "required": ["kernelRef", "initrdRef", "rootfsRef"],
      "properties": {
        "kernelRef": { "type": "string" },
        "initrdRef": { "type": "string" },
        "rootfsRef": { "type": "string" },
        "artifactMapRef": { "type": ["string", "null"] },
        "cachePolicyRef": { "type": ["string", "null"] }
      }
    },
    "platformAdapters": {
      "type": "array",
      "minItems": 1,
      "items": {
        "type": "object",
        "additionalProperties": false,
        "required": ["adapter", "mode", "status"],
        "properties": {
          "adapter": { "type": "string", "enum": ["apple-silicon-m2", "linux-kexec", "uefi-ipxe", "purism-linux", "vm-bootstrap", "other"] },
          "mode": { "type": "string", "enum": ["dry-run", "load-only", "execute", "planned"] },
          "status": { "type": "string", "enum": ["implemented", "dry-run-only", "planned", "blocked"] },
          "entryRefs": { "type": "array", "items": { "type": "string" } },
          "requiresHostMutation": { "type": "boolean", "default": true },
          "requiresRebootAck": { "type": "boolean", "default": false }
        }
      }
    },
    "authorization": {
      "type": "object",
      "additionalProperties": false,
      "required": ["enrollmentTokenRequired", "oneTimeUseRequired", "deviceClaimRequired"],
      "properties": {
        "enrollmentTokenRequired": { "type": "boolean" },
        "oneTimeUseRequired": { "type": "boolean" },
        "deviceClaimRequired": { "type": "boolean" },
        "purpose": { "type": "string", "enum": ["install", "recover", "bootstrap", "ephemeral", "test"] }
      }
    },
    "offlineFallback": {
      "type": "object",
      "additionalProperties": false,
      "required": ["lastKnownGoodRequired", "allowUnsignedFallback", "fallbackCacheRef"],
      "properties": {
        "lastKnownGoodRequired": { "type": "boolean" },
        "allowUnsignedFallback": { "const": false },
        "fallbackCacheRef": { "type": ["string", "null"] }
      }
    },
    "signing": {
      "type": "object",
      "additionalProperties": false,
      "required": ["signerRef", "signatureRef", "signatureAlgorithm", "cryptoProfile"],
      "properties": {
        "signerRef": { "type": "string" },
        "signatureRef": { "type": "string", "pattern": "^urn:srcos:signature:" },
        "signatureAlgorithm": { "type": "string", "enum": ["rsa-pss-sha256", "ed25519", "other"] },
        "cryptoProfile": { "type": "string", "enum": ["fips-140-3-compatible", "standard", "development"] }
      }
    },
    "proofs": {
      "type": "object",
      "additionalProperties": false,
      "required": ["emitBootPlan", "emitFetchRecord", "emitAdapterRecord", "emitFingerprint"],
      "properties": {
        "emitBootPlan": { "type": "boolean" },
        "emitFetchRecord": { "type": "boolean" },
        "emitAdapterRecord": { "type": "boolean" },
        "emitFingerprint": { "type": "boolean" },
        "requiredEvidenceKinds": { "type": "array", "items": { "type": "string" } }
      }
    }
  }
}
